{
  "$schema": "requirements.schema.json",
  "catalog_id": "SPEC-REQUIREMENTS-V0.1-ALPHA.1",
  "spec": "0.1-alpha",
  "status": "exercise",
  "source": {
    "path": "../../spec.md",
    "normalization": "utf-8-lf",
    "sha256": "sha256:303eaa54f255d074c68bad55a8cef5a679c1a010abfbb08e4b5afb52f15b431e",
    "normative_keyword_occurrences": 43
  },
  "excluded_occurrences": [
    {
      "source_occurrence": 2,
      "keyword": "MUST",
      "reason": "RFC 2119/8174 keyword-definition text, not a protocol requirement."
    },
    {
      "source_occurrence": 3,
      "keyword": "MUST NOT",
      "reason": "RFC 2119/8174 keyword-definition text, not a protocol requirement."
    }
  ],
  "requirements": [
    {
      "id": "SPEC-01-001",
      "source_occurrence": 1,
      "section": "1",
      "keyword": "MUST NOT",
      "requirement": "Optional inference profiles do not change the meaning of Core declarations.",
      "applies_to": ["SPEC Project", "Profile Authors"],
      "disposition": "inspection-required",
      "test_ids": [],
      "evidence": ["spec.md#1-scope"],
      "verification": "Review each profile specification for semantic overrides of Core fields or declarations."
    },
    {
      "id": "SPEC-02-001",
      "source_occurrence": 4,
      "section": "2",
      "keyword": "MUST",
      "requirement": "A conforming implementation preserves all ten architecture invariants.",
      "applies_to": ["Core Consumer", "Resolver", "Representation Handler", "Processor Host", "Composer", "Planner", "Provenance Producer", "SPEC Project"],
      "disposition": "partially-tested",
      "test_ids": ["CV-NOMINAL-IDENTITY", "CV-IMPLEMENTATION-RESOLUTION", "CV-STATE-FAIL-CLOSED", "CV-IMMUTABLE-VERSION", "CV-TRANSITIVE-ROUTE", "CV-HOST-EXECUTES", "CV-RECEIPT-EMISSION"],
      "evidence": ["spec.md#2-architecture-invariants"],
      "verification": "Current tests cover nominal identity, declaration/implementation separation, visible state, hard identity, explicit routing, and provenance; multiple representations, standards reuse, and independent non-Kalo implementation remain unproven."
    },
    {
      "id": "SPEC-04-001",
      "source_occurrence": 5,
      "section": "4",
      "keyword": "MUST",
      "requirement": "Every Core descriptor contains the spec and kind envelope fields.",
      "applies_to": ["Core Consumer", "Core Publisher", "Processor Descriptor Publisher", "Provenance Producer"],
      "disposition": "tested",
      "test_ids": ["CV-SCHEMAS-VALID", "CV-DESCRIPTORS-VALID"],
      "evidence": ["schemas/v0/base.schema.json"],
      "verification": "Validate every canonical descriptor kind against its schema and load the complete canonical catalog."
    },
    {
      "id": "SPEC-04-002",
      "source_occurrence": 6,
      "section": "4",
      "keyword": "MUST",
      "requirement": "Descriptor map keys are strings in the JSON data model.",
      "applies_to": ["Core Consumer", "Core Publisher"],
      "disposition": "deferred",
      "test_ids": [],
      "evidence": [],
      "verification": "Add YAML fixtures with non-string map keys and require consumers and publishers to reject them."
    },
    {
      "id": "SPEC-04-003",
      "source_occurrence": 7,
      "section": "4",
      "keyword": "MUST NOT",
      "requirement": "Publishers do not assign semantics to map ordering, YAML tags, anchors or aliases, duplicate keys, comments, or non-JSON scalar types.",
      "applies_to": ["Core Publisher", "Processor Descriptor Publisher", "Provenance Producer"],
      "disposition": "inspection-required",
      "test_ids": [],
      "evidence": ["spec.md#4-descriptor-envelope-and-encoding"],
      "verification": "Inspect publisher serialization and round-trip behavior; the draft suite has no Publisher claim gate."
    },
    {
      "id": "SPEC-05-001",
      "source_occurrence": 8,
      "section": "5.1",
      "keyword": "MUST",
      "requirement": "Namespace, name, and binding tokens use uppercase ASCII.",
      "applies_to": ["Core Consumer", "Core Publisher", "Resolver"],
      "disposition": "tested",
      "test_ids": ["CV-ADDRESS-VALID", "CV-ADDRESS-INVALID"],
      "evidence": ["fixtures/addresses/valid.json", "fixtures/addresses/invalid.json"],
      "verification": "Run every canonical address vector through the implementation parser."
    },
    {
      "id": "SPEC-05-002",
      "source_occurrence": 9,
      "section": "5.1",
      "keyword": "MUST",
      "requirement": "Namespace, name, and binding tokens start with A-Z and contain only A-Z, digits, or hyphen thereafter.",
      "applies_to": ["Core Consumer", "Core Publisher", "Resolver"],
      "disposition": "tested",
      "test_ids": ["CV-ADDRESS-VALID", "CV-ADDRESS-INVALID"],
      "evidence": ["fixtures/addresses/valid.json", "fixtures/addresses/invalid.json"],
      "verification": "Accept valid token vectors and reject invalid token starts and characters."
    },
    {
      "id": "SPEC-05-003",
      "source_occurrence": 10,
      "section": "5.1",
      "keyword": "MUST",
      "requirement": "A version starts with a digit and then contains only ASCII letters, digits, dot, or hyphen.",
      "applies_to": ["Core Consumer", "Core Publisher", "Resolver"],
      "disposition": "tested",
      "test_ids": ["CV-ADDRESS-VALID", "CV-ADDRESS-INVALID"],
      "evidence": ["fixtures/addresses/valid.json", "fixtures/addresses/invalid.json"],
      "verification": "Accept valid version vectors and reject resource or binding versions that do not start with a digit."
    },
    {
      "id": "SPEC-05-004",
      "source_occurrence": 11,
      "section": "5.1",
      "keyword": "MUST NOT",
      "requirement": "Address comparison does not apply percent encoding, URL normalization, Unicode normalization, or case folding.",
      "applies_to": ["Core Consumer", "Core Publisher", "Resolver"],
      "disposition": "partially-tested",
      "test_ids": ["CV-ADDRESS-INVALID"],
      "evidence": ["fixtures/addresses/invalid.json"],
      "verification": "Percent-encoded, URL-shaped, and case-invalid inputs are rejected; explicit Unicode-normalization vectors are still missing."
    },
    {
      "id": "SPEC-06-001",
      "source_occurrence": 12,
      "section": "6",
      "keyword": "MUST NOT",
      "requirement": "A symbolic address is not the sole source of hard identity.",
      "applies_to": ["Core Consumer", "Core Publisher", "Resolver"],
      "disposition": "tested",
      "test_ids": ["CV-IMMUTABLE-VERSION", "CV-NAMESPACE-IDENTITY"],
      "evidence": ["fixtures/negative/cases.json"],
      "verification": "Reject conflicting immutable resource and Namespace identities behind symbolic names."
    },
    {
      "id": "SPEC-06-002",
      "source_occurrence": 13,
      "section": "6",
      "keyword": "MUST",
      "requirement": "A resolver rejects results whose namespace, family, or version identity does not satisfy requester constraints.",
      "applies_to": ["Resolver"],
      "disposition": "partially-tested",
      "test_ids": ["CV-BINDING-RESOLUTION", "CV-IMMUTABLE-VERSION", "CV-NAMESPACE-IDENTITY"],
      "evidence": ["fixtures/negative/cases.json"],
      "verification": "Current cases exercise missing bindings and conflicting Contract/Namespace identity; explicit family-ID and all resource-kind mismatch vectors remain missing."
    },
    {
      "id": "SPEC-06-003",
      "source_occurrence": 14,
      "section": "6",
      "keyword": "MUST",
      "requirement": "Published Contract, Processor, and Representation Binding versions are immutable.",
      "applies_to": ["Core Consumer", "Core Publisher", "Resolver", "Processor Descriptor Publisher"],
      "disposition": "partially-tested",
      "test_ids": ["CV-IMMUTABLE-VERSION"],
      "evidence": ["fixtures/negative/cases.json"],
      "verification": "The suite rejects a mutated Contract Version; equivalent Processor and Representation Binding mutation cases are still missing."
    },
    {
      "id": "SPEC-06-004",
      "source_occurrence": 15,
      "section": "6",
      "keyword": "MUST NOT",
      "requirement": "A publisher does not silently retarget a symbolic address to a semantically different immutable version.",
      "applies_to": ["Core Publisher", "Processor Descriptor Publisher"],
      "disposition": "deferred",
      "test_ids": [],
      "evidence": [],
      "verification": "Define Publisher fixtures that publish, attempt retargeting, and verify rejection plus new-version behavior."
    },
    {
      "id": "SPEC-06-005",
      "source_occurrence": 16,
      "section": "6",
      "keyword": "MUST",
      "requirement": "An external descriptor-digest record makes the serialized form or media type explicit.",
      "applies_to": ["Core Publisher", "Resolver"],
      "disposition": "inspection-required",
      "test_ids": [],
      "evidence": ["spec.md#6-identity-publication-and-immutability"],
      "verification": "Inspect each catalog, manifest, or publication format that records descriptor-byte digests."
    },
    {
      "id": "SPEC-06-006",
      "source_occurrence": 17,
      "section": "6",
      "keyword": "MUST",
      "requirement": "Every ProcessorImplementation descriptor digests its executable artifact.",
      "applies_to": ["Resolver", "Processor Host"],
      "disposition": "tested",
      "test_ids": ["CV-DESCRIPTORS-VALID", "CV-DIGEST-MISMATCH", "CV-IMPLEMENTATION-RESOLUTION"],
      "evidence": ["schemas/v0/processor-implementation.schema.json"],
      "verification": "Require the digest field, resolve the implementation, and reject exact-byte digest mismatch."
    },
    {
      "id": "SPEC-07-001",
      "source_occurrence": 18,
      "section": "7",
      "keyword": "MUST",
      "requirement": "A resolver surfaces an ambiguous Namespace alias rather than choosing an authority silently.",
      "applies_to": ["Resolver", "Core Consumer"],
      "disposition": "tested",
      "test_ids": ["CV-NAMESPACE-IDENTITY"],